<?xml version="1.0" encoding="UTF-8"?>
<xs:schema xmlns:xs="http://www.w3.org/2001/XMLSchema">
    <xs:element name="inventario">
        <xs:complexType>
            <xs:sequence>
                <xs:element name="producto" minOccurs="1" maxOccurs="unbounded">
                    <xs:complexType>
                        <xs:sequence>
                            <xs:element name="nombre" type="xs:string" />
                            <xs:element name="tamaño" type="xs:string" />
                            <xs:element name="color" type="xs:string" />
                            <xs:element name="precio" type="xs:float" />
                            <xs:element name="stock" type="xs:integer" />
                        </xs:sequence>
                        <xs:attribute name="id" type="xs:ID"></xs:attribute>
                    </xs:complexType>
                </xs:element>
            </xs:sequence>
        </xs:complexType>        
    </xs:element>
</xs:schema>